codigoOrgao,nomeOrgao,nomeMnemonicoOrgao,cnpjCpfOrgao,codigoOrgaoVinculado,cnpjCpfOrgaoVinculado,nomeOrgaoVinculado,codigoOrgaoSuperior,cnpjCpfOrgaoSuperior,nomeOrgaoSuperior,codigoTipoAdministracao,nomeTipoAdministracao,poder,esfera,usoSisg,statusOrgao,dataHoraMovimento
96810,PREFEITURA MUNICIPAL DE SENTINELA DO SUL - RS,PM SENTINELA DO SUL,94068277000108,96320.0,87934675000196,ERS-ESTADO DO RIO GRANDE DO SUL,96000.0,0,REGIAO SUL,12,ADMINISTRACAO DIRETA MUNICIPAL,E,M,True,True,2024-01-14T13:57:00
96750,PREFEITURA MUNICIPAL SALVADOR DAS MISSÕES-RS,PM SALVADOR MISSÕES,93592731000154,96320.0,87934675000196,ERS-ESTADO DO RIO GRANDE DO SUL,96000.0,0,REGIAO SUL,12,ADMINISTRACAO DIRETA MUNICIPAL,E,M,True,True,2024-01-14T13:57:00
96797,PREFEITURA MUNICIPAL SÃO PEDRO DO BUTIÁ - RS,PM S.PEDRO DO BUTIÁ,93592715000161,96320.0,87934675000196,ERS-ESTADO DO RIO GRANDE DO SUL,96000.0,0,REGIAO SUL,12,ADMINISTRACAO DIRETA MUNICIPAL,E,M,True,True,2024-01-14T13:57:00
96788,CAMARA MUNICIPAL DE SÃO LUIZ GONZAGA - RS,CM SÃO LUIZ GONZAGA,93592384000160,96320.0,87934675000196,ERS-ESTADO DO RIO GRANDE DO SUL,96000.0,0,REGIAO SUL,12,ADMINISTRACAO DIRETA MUNICIPAL,,M,True,True,2024-01-14T13:57:00
96567,PREFEITURA MUNICIPAL DE CENTENÁ RIO - RS,PM CENTENÁ RIO/RS,93539138000144,96320.0,87934675000196,ERS-ESTADO DO RIO GRANDE DO SUL,96000.0,0,REGIAO SUL,12,ADMINISTRACAO DIRETA MUNICIPAL,E,M,True,True,2024-01-14T13:57:00
96830,PREFEITURA MUNICIPAL DE TRES FORQUILHAS - RS,PM TRES FORQUILHAS,93317998000133,96320.0,87934675000196,ERS-ESTADO DO RIO GRANDE DO SUL,96000.0,0,REGIAO SUL,12,ADMINISTRACAO DIRETA MUNICIPAL,E,M,True,True,2024-01-14T13:57:00
96533,PREFEITURA MUNICIPAL DE SÃO PEDRO DA SERRA-RS,PM S.PEDRO DA SERRA,93235968000188,96320.0,87934675000196,ERS-ESTADO DO RIO GRANDE DO SUL,96000.0,0,REGIAO SUL,12,ADMINISTRACAO DIRETA MUNICIPAL,E,M,True,True,2024-09-28T11:44:00
38724,CONSELHO REGIONAL DE FARMÁCIA-RS,CRF-RS,93026771000139,38749.0,60984473000100,CONSELHO FEDERAL DE FARMACIA,38000.0,37115367000160,MINISTERIO DO TRABALHO E EMPREGO,3,AUTARQUIA,E,F,True,True,2023-03-16T17:02:00
96841,CENTRO DE PESQUISA DA REGIÃO NORDESTE - RS,CENT.PESQ.REG.NORD.,93021632003561,96320.0,87934675000196,ERS-ESTADO DO RIO GRANDE DO SUL,96000.0,0,REGIAO SUL,11,ADMINISTRACAO DIRETA ESTADUAL,E,E,True,True,2024-01-14T13:57:00
38719,CONSELHO REGIONAL DE ODONTOLOGIA - RS,CRO-RS,93012987000145,38661.0,61919643000209,CONSELHO FEDERAL DE ODONTOLOGIA,36000.0,00394544000185,MINISTERIO DA SAUDE,3,AUTARQUIA,E,F,True,True,2023-03-17T15:37:00
38930,CONSELHO REGIONAL DE MEDICINA VETERINARIA/RS,CRMV-RS,93009116000172,38758.0,00119784000171,CONSELHO FEDERAL DE MEDICINA VETERINARIA,,,,3,AUTARQUIA,E,F,True,True,2025-07-29T13:20:00
26244,UNIVERSIDADE FEDERAL DO RIO GRANDE DO SUL,UFRS,92969856000198,26000.0,00394445000101,MINISTERIO DA EDUCACAO,20101.0,00394411000109,PRESIDENCIA DA REPUBLICA,3,AUTARQUIA,E,F,True,True,2025-07-07T15:17:00
26284,FUNDACAO FACULDADE FED.CIENCIAS MEDICAS POA,FFFCM,92967595000177,26000.0,00394445000101,MINISTERIO DA EDUCACAO,20101.0,00394411000109,PRESIDENCIA DA REPUBLICA,4,FUNDACAO,E,F,True,True,2025-07-07T15:22:00
38709,CONSELHO REG. CORRETO DE IMOVEIS 3ª REGIAO/RS,CRECI-RS,92966159000183,38689.0,62658737000153,CONSELHO FEDERAL DE CORRETORES DE IMÓVEIS,38000.0,37115367000160,MINISTERIO DO TRABALHO E EMPREGO,3,AUTARQUIA,E,F,True,True,2025-06-26T10:10:00
38557,CONSELHO REG.DOS REPRESENTANTES COMERCIAIS-RS,CORE/RS,92963776000125,38676.0,34046367000168,CONSELHO FEDER. DOS REPRESENTANTES COMERCIAIS,38000.0,37115367000160,MINISTERIO DO TRABALHO E EMPREGO,3,AUTARQUIA,E,F,True,True,2024-02-16T13:10:00
96330,PREFEITURA MUNICIPAL DE PORTO ALEGRE - RS,PM PORTO ALEGRE,92963560000160,96320.0,87934675000196,ERS-ESTADO DO RIO GRANDE DO SUL,96000.0,0,REGIAO SUL,12,ADMINISTRACAO DIRETA MUNICIPAL,E,M,True,True,2024-01-13T13:57:00
96339,FUNDAÇÃO ORQUESTRA SINFONICA DE PORTO ALEGRE,ORQUESTRA SINFONICA,92954874000104,96330.0,92963560000160,PREFEITURA MUNICIPAL DE PORTO ALEGRE - RS,96320.0,87934675000196,ERS-ESTADO DO RIO GRANDE DO SUL,3,AUTARQUIA,E,E,True,True,2024-02-16T14:07:00
96335,DEPARTAMENTO MUNICIPAL DE AGUA E ESGOTOS,DMAE PORTO ALEGRE,92924901000198,96330.0,92963560000160,PREFEITURA MUNICIPAL DE PORTO ALEGRE - RS,96320.0,87934675000196,ERS-ESTADO DO RIO GRANDE DO SUL,3,AUTARQUIA,E,M,True,True,2024-04-05T15:46:00
96532,SISTEMA DE PREVIDENCIA MUNICIPAL-SANTANA LIVR,SISPREM-SANTAN LIVR,92913581000170,96442.0,88124961000159,PREFEITURA DE SANTANA DO LIVRAMENTO,96320.0,87934675000196,ERS-ESTADO DO RIO GRANDE DO SUL,1,ADMINISTRACAO DIRETA,E,M,True,True,2025-04-29T09:33:00
38900,CONSELHO REGIONAL DE ADMINISTRAÇÃO/RS,CRA/RS,92913318000181,38586.0,34061135000189,CONSELHO FEDERAL DE ADMINISTRAÇÃO,38000.0,37115367000160,MINISTERIO DO TRABALHO E EMPREGO,3,AUTARQUIA,E,F,True,True,2025-07-28T08:59:00
96663,FUNDAÇÃO MÉDICA HOSPITALAR DR. HONOR TEIXEIRA,F.HOSP.HON.TEIXEIRA,92911684000100,96662.0,88201298000149,PREFEITURA MUNICIPAL DE LAVRAS DO SUL - RS,96320.0,87934675000196,ERS-ESTADO DO RIO GRANDE DO SUL,4,FUNDACAO,E,M,True,True,2024-01-14T13:57:00
96341,FUNDAÇÃO UNIVERSITÃ RIA DE CARDIOLOGIA,FUND.UNIV.CARDIO.,92898550000198,96330.0,92963560000160,PREFEITURA MUNICIPAL DE PORTO ALEGRE - RS,96320.0,87934675000196,ERS-ESTADO DO RIO GRANDE DO SUL,4,FUNDACAO,E,M,True,True,2024-01-13T13:57:00
80202,SUPERINTENDENCIA DO DESENV.DA REGIAO SUL-EXT.,SUDESUL-EM EXTINCAO,92885151000192,20113.0,00489828000155,MINISTERIO DO PLANEJAMENTO E ORÇAMENTO - MPO,20101.0,00394411000109,PRESIDENCIA DA REPUBLICA,3,AUTARQUIA,E,F,True,True,2025-07-07T16:04:00
86992,DEPARTAMENTO AUTON. DE ESTRADAS DE RODAGEM/RS,DAER/CRBM,92883834000100,96320.0,87934675000196,ERS-ESTADO DO RIO GRANDE DO SUL,96000.0,0,REGIAO SUL,3,AUTARQUIA,E,E,True,True,2025-06-26T13:31:00
96523,PREFEITURA MUNICIPAL DE CAMPESTRE DA SERRA-RS,PM CAMPESTRE SERRA,92868868000126,96320.0,87934675000196,ERS-ESTADO DO RIO GRANDE DO SUL,96000.0,0,REGIAO SUL,12,ADMINISTRACAO DIRETA MUNICIPAL,E,M,True,True,2024-01-13T13:57:00
96385,CAMARA MUNICIPAL DE CAXIAS DO SUL,CM CAXIAS SUL,92862234000166,96320.0,87934675000196,ERS-ESTADO DO RIO GRANDE DO SUL,96000.0,0,REGIAO SUL,12,ADMINISTRACAO DIRETA MUNICIPAL,E,M,True,True,2023-02-14T15:26:00
96416,INSTITUTO RIO GRANDENSE DO ARROZ,INST. RIOGRANDENSE,92854876000113,96320.0,87934675000196,ERS-ESTADO DO RIO GRANDE DO SUL,96000.0,0,REGIAO SUL,3,AUTARQUIA,E,E,True,True,2024-01-13T13:57:00
96333,COMPANHIA RIOGRANDENSE DE SANEAMENTO - POA,CORSAN - POA/RS,92802784000190,96330.0,92963560000160,PREFEITURA MUNICIPAL DE PORTO ALEGRE - RS,96320.0,87934675000196,ERS-ESTADO DO RIO GRANDE DO SUL,6,ECONOMIA MISTA,E,E,True,True,2024-04-01T10:31:00
36208,HOSPITAL CRISTO REDENTOR S/A,HOSP.C.REDENTOR S/A,92787126000176,36000.0,00394544000185,MINISTERIO DA SAUDE,20101.0,00394411000109,PRESIDENCIA DA REPUBLICA,6,ECONOMIA MISTA,E,F,True,True,2025-07-07T15:45:00
36210,HOSPITAL NOSSA SENHORA DA CONCEICAO S/A,HOSP.N.S.CONCEI.S/A,92787118000120,36000.0,00394544000185,MINISTERIO DA SAUDE,20101.0,00394411000109,PRESIDENCIA DA REPUBLICA,6,ECONOMIA MISTA,E,F,True,True,2025-07-07T15:45:00
38517,CONSELHO REGIONAL DE CONTABILIDADE-RS,CRC-RS,92698471000133,38500.0,33618570000107,CONSELHO FEDERAL DE CONTABILIDADE,48000.0,00489828000155,MINISTERIO DA GESTÃO E INOV EM SERV PUBLICO,3,AUTARQUIA,E,F,True,True,2023-03-14T17:06:00
38662,CONSELHO REG. DE ENGENHARIA E AGRONOMIA-RS,CREA-RS,92695790000195,,,,,,,3,AUTARQUIA,E,F,True,True,2023-10-19T15:21:00
36209,HOSPITAL FEMINA S/A,HOSPITAL FEMINA S/A,92693134000153,36000.0,00394544000185,MINISTERIO DA SAUDE,20101.0,00394411000109,PRESIDENCIA DA REPUBLICA,6,ECONOMIA MISTA,E,F,True,True,2025-07-07T15:45:00
96338,FUND. PÃO DOS POBRES DE STO. ANTONIO,FUND.DE STO.ANTONIO,92666015000101,96330.0,92963560000160,PREFEITURA MUNICIPAL DE PORTO ALEGRE - RS,96320.0,87934675000196,ERS-ESTADO DO RIO GRANDE DO SUL,4,FUNDACAO,E,M,True,True,2024-04-01T10:18:00
96812,PREFEITURA MUNICIPAL DE SILVEIRA MARTINS - RS,PM SILVEIRA MARTINS,92457217000143,96320.0,87934675000196,ERS-ESTADO DO RIO GRANDE DO SUL,96000.0,0,REGIAO SUL,12,ADMINISTRACAO DIRETA MUNICIPAL,E,M,True,True,2024-01-14T13:57:00
86038,PREFEITURA MUNICIPAL DE NOVA ESPERANÇA DO SUL,PM NOVA ESP. DO SUL,92455393000146,96320.0,87934675000196,ERS-ESTADO DO RIO GRANDE DO SUL,96000.0,0,REGIAO SUL,12,ADMINISTRACAO DIRETA MUNICIPAL,E,M,True,True,2024-10-17T17:05:00
96418,PREFEITURA DE NOVA ESPERANÇA DO SUL/RS,PM N. ESPER.DO SUL,92455393000146,96320.0,87934675000196,ERS-ESTADO DO RIO GRANDE DO SUL,96000.0,0,REGIAO SUL,12,ADMINISTRACAO DIRETA MUNICIPAL,E,M,True,True,2023-02-15T14:06:00
96727,PREFEITURA MUNICIPAL DE POUSO NOVO - RS,PM POUSO NOVO - RS,92454826000149,96320.0,87934675000196,ERS-ESTADO DO RIO GRANDE DO SUL,96000.0,0,REGIAO SUL,12,ADMINISTRACAO DIRETA MUNICIPAL,E,M,True,True,2024-01-14T13:57:00
96729,PREFEITURA MUNICIPAL DE PROGRESSO - RS,PM DE PROGRESSO-RS,92454800000109,96320.0,87934675000196,ERS-ESTADO DO RIO GRANDE DO SUL,96000.0,0,REGIAO SUL,12,ADMINISTRACAO DIRETA MUNICIPAL,E,M,True,True,2024-01-14T13:57:00
96639,PREFEITURA MUNICIPAL DE IMIGRANTE - RS,PM DE IMIGRANTE-RS,92454776000108,96320.0,87934675000196,ERS-ESTADO DO RIO GRANDE DO SUL,96000.0,0,REGIAO SUL,12,ADMINISTRACAO DIRETA MUNICIPAL,E,M,True,True,2024-01-14T13:57:00
96726,PREFEITURA MUNICIPAL DE PORTÃO - RS,PM DE PORTÃO - RS,92451152000129,96320.0,87934675000196,ERS-ESTADO DO RIO GRANDE DO SUL,96000.0,0,REGIAO SUL,12,ADMINISTRACAO DIRETA MUNICIPAL,E,M,True,True,2024-01-14T13:57:00
96767,PREFEITURA MUNICIPAL STO. ANTONIO DO PALMA-RS,PM SANT.ANTON.PALMA,92412832000133,96320.0,87934675000196,ERS-ESTADO DO RIO GRANDE DO SUL,96000.0,0,REGIAO SUL,12,ADMINISTRACAO DIRETA MUNICIPAL,E,M,True,True,2024-01-14T13:57:00
96343,PREFEITURA MUN. DE MATO CASTELHANO,PMMC,92412808000102,,,,,,,12,ADMINISTRACAO DIRETA MUNICIPAL,E,M,True,True,2024-02-21T10:46:00
96856,PREFEITURA MUNICIPAL DE COXILHA - RS,PM DE COXILHA - RS,92411933000190,96320.0,87934675000196,ERS-ESTADO DO RIO GRANDE DO SUL,96000.0,0,REGIAO SUL,12,ADMINISTRACAO DIRETA MUNICIPAL,E,M,True,True,2024-01-14T13:57:00
96623,PREFEITURA MUNICIPAL DE GENTIL - RS,PM DE GENTIL - RS,92411875000102,96320.0,87934675000196,ERS-ESTADO DO RIO GRANDE DO SUL,96000.0,0,REGIAO SUL,12,ADMINISTRACAO DIRETA MUNICIPAL,E,M,True,True,2024-01-14T13:57:00
96489,PREFEITURA  DE AMETISTA DO SUL - RS,PM AMETISTA DO SUL,92411156000183,96320.0,87934675000196,ERS-ESTADO DO RIO GRANDE DO SUL,96000.0,0,REGIAO SUL,12,ADMINISTRACAO DIRETA MUNICIPAL,E,M,True,True,2024-01-13T13:57:00
96588,PREFEITURA MUNICPAL DOIS IRMÃOS DAS MISSÕES,PM DOIS IR.MISSÕES,92411115000197,96320.0,87934675000196,ERS-ESTADO DO RIO GRANDE DO SUL,96000.0,0,REGIAO SUL,12,ADMINISTRACAO DIRETA MUNICIPAL,E,M,True,True,2024-01-14T13:57:00
96723,PREFEITURA MUNICIPAL PINHEIRINHO DO VALE - RS,PM PINHEIRINHO VALE,92411099000132,96320.0,87934675000196,ERS-ESTADO DO RIO GRANDE DO SUL,96000.0,0,REGIAO SUL,12,ADMINISTRACAO DIRETA MUNICIPAL,E,M,True,True,2024-01-14T13:57:00
96512,PREFEITURA MUNICIPAL BOA VISTA DAS MISSOES-RS,PM BOA .VISTA.DAS,92410562000121,96320.0,87934675000196,ERS-ESTADO DO RIO GRANDE DO SUL,96000.0,0,REGIAO SUL,12,ADMINISTRACAO DIRETA MUNICIPAL,E,M,True,True,2024-01-13T13:57:00
96695,PREFEITURA MUNICIPAL DE NOVO BARREIRO - RS,PM NOVO BARREIRO-RS,92410521000135,96320.0,87934675000196,ERS-ESTADO DO RIO GRANDE DO SUL,96000.0,0,REGIAO SUL,12,ADMINISTRACAO DIRETA MUNICIPAL,E,M,True,True,2024-01-14T13:57:00
96798,PREFEITURA MUNICIPAL DE SAO JOSE DAS MISSOES,PM SÃO JOSE MISSÕES,92410463000140,96320.0,87934675000196,ERS-ESTADO DO RIO GRANDE DO SUL,96000.0,0,REGIAO SUL,12,ADMINISTRACAO DIRETA MUNICIPAL,E,M,True,True,2024-01-14T13:57:00
96781,PREFEITURA MUNICIPAL DE SÃO JOSÉ DO HERVAL-RS,PM SÃO JOSÉ HERVAL,92406511000126,96320.0,87934675000196,ERS-ESTADO DO RIO GRANDE DO SUL,96000.0,0,REGIAO SUL,12,ADMINISTRACAO DIRETA MUNICIPAL,E,M,True,True,2024-01-14T13:57:00
89330,PREFEITURA MUNICIPAL DE IBIRAPUITA/RS,PM/IBIRAPUITA/RS,92406263000113,96320.0,87934675000196,ERS-ESTADO DO RIO GRANDE DO SUL,96000.0,0,REGIAO SUL,12,ADMINISTRACAO DIRETA MUNICIPAL,E,M,True,True,2025-08-13T16:43:00
96844,PREFEITURA MUNICIPAL DE VANINI - RS,PM DE VANINI - RS,92406206000134,96320.0,87934675000196,ERS-ESTADO DO RIO GRANDE DO SUL,96000.0,0,REGIAO SUL,12,ADMINISTRACAO DIRETA MUNICIPAL,E,M,True,True,2024-01-14T13:57:00
96603,PREFEITURA MUNICIPAL DE ERNESTINA - RS,PM DE ERNESTINA-RS,92406180000124,96320.0,87934675000196,ERS-ESTADO DO RIO GRANDE DO SUL,96000.0,0,REGIAO SUL,12,ADMINISTRACAO DIRETA MUNICIPAL,E,M,True,True,2024-01-14T13:57:00
96522,PREFEITURA MUNICIPAL DE CAMARGO - RS,PM DE CAMARGO - RS,92406099000144,96320.0,87934675000196,ERS-ESTADO DO RIO GRANDE DO SUL,96000.0,0,REGIAO SUL,12,ADMINISTRACAO DIRETA MUNICIPAL,E,M,True,True,2024-01-13T13:57:00
85886,PREFEITURA MUNICIPAL DE ALTO ALEGRE/RS,PM/ALTO ALEGRE/RS,92406057000103,96320.0,87934675000196,ERS-ESTADO DO RIO GRANDE DO SUL,96000.0,0,REGIAO SUL,12,ADMINISTRACAO DIRETA MUNICIPAL,E,M,True,True,2024-09-23T14:49:00
96851,PREFEITURA MUNICIPAL DE VISTA ALEGRE - RS,PM VISTA ALEGRE-RS,92403583000110,96320.0,87934675000196,ERS-ESTADO DO RIO GRANDE DO SUL,96000.0,0,REGIAO SUL,12,ADMINISTRACAO DIRETA MUNICIPAL,E,M,True,True,2024-01-14T13:57:00
96734,PREFEITURA MUNICIPAL DE RELVADO - RS,PM DE RELVADO - RS,92402510000103,96320.0,87934675000196,ERS-ESTADO DO RIO GRANDE DO SUL,96000.0,0,REGIAO SUL,12,ADMINISTRACAO DIRETA MUNICIPAL,E,M,True,True,2024-01-14T13:57:00
96654,PREFEITURA MUNICIPAL DE JAQUIRANA - RS,PM DE JAQUIRANA-RS,92401561000110,96320.0,87934675000196,ERS-ESTADO DO RIO GRANDE DO SUL,96000.0,0,REGIAO SUL,12,ADMINISTRACAO DIRETA MUNICIPAL,E,M,True,True,2024-01-14T13:57:00
96832,PREFEITURA MUNICIPAL DE TRINDADE DO SUL - RS,PM TRINDADE DO SUL,92399211000167,96320.0,87934675000196,ERS-ESTADO DO RIO GRANDE DO SUL,96000.0,0,REGIAO SUL,12,ADMINISTRACAO DIRETA MUNICIPAL,E,M,True,True,2024-01-14T13:57:00
96426,ASSOC. AMPARO PESQUISA M FARMACOLOGIA TOXICOL,ASS.PESQ.FARM.TOX.,92398056000164,96320.0,87934675000196,ERS-ESTADO DO RIO GRANDE DO SUL,96000.0,0,REGIAO SUL,15,EMPRESA PRIVADA,E,E,True,True,2024-04-01T15:26:00
38716,CONSELHO REG. DE TECNICOS EM RADIOLOGIA 6º-RS,CRTR-RS,92396134000191,38545.0,03635323000140,CONSELHO NACIONAL DE TECNICOS EM RADIOLOGIA,,,,3,AUTARQUIA,E,F,True,True,2025-07-23T14:01:00
26278,FUNDACAO UNIVERSIDADE FEDERAL DE PELOTAS,FUF-PELOTAS,92242080000100,26000.0,00394445000101,MINISTERIO DA EDUCACAO,20101.0,00394411000109,PRESIDENCIA DA REPUBLICA,4,FUNDACAO,E,F,True,True,2025-07-07T15:21:00
85444,PREFEITURA MUNICIPAL DE ALTO FELIZ,PMAF,92123926000192,96320.0,87934675000196,ERS-ESTADO DO RIO GRANDE DO SUL,96000.0,0,REGIAO SUL,12,ADMINISTRACAO DIRETA MUNICIPAL,E,M,True,True,2024-06-26T08:22:00
96665,PREFEITURA MUNICIPAL DE LINHA NOVA - RS,PM LINHA NOVA - RS,92123900000144,96320.0,87934675000196,ERS-ESTADO DO RIO GRANDE DO SUL,96000.0,0,REGIAO SUL,12,ADMINISTRACAO DIRETA MUNICIPAL,E,M,True,True,2024-01-14T13:57:00
96377,CAMARA MUNICIPAL DE CACHOEIRINHA/RS,CM DE CACHOEIRINHA,92099811000100,96320.0,87934675000196,ERS-ESTADO DO RIO GRANDE DO SUL,96000.0,0,REGIAO SUL,12,ADMINISTRACAO DIRETA MUNICIPAL,E,M,True,True,2024-07-15T17:39:00
96617,FUNDACAO UNIVERSIDADE DE PASSO FUNDO,FUNDA.UNIV.P.FUNDO,92034321000125,96860.0,87612537000190,PREFEITURA MUNICIPAL DE PASSO FUNDO - RS,96320.0,87934675000196,ERS-ESTADO DO RIO GRANDE DO SUL,4,FUNDACAO,E,M,True,True,2024-04-03T16:10:00
96503,PREFEITURA MUNICIPAL DE PINHAL - RS,PM DE PINHAL - RS,92005586000103,96320.0,87934675000196,ERS-ESTADO DO RIO GRANDE DO SUL,96000.0,0,REGIAO SUL,12,ADMINISTRACAO DIRETA MUNICIPAL,E,M,True,True,2024-01-13T13:57:00
96649,PREFEITURA MUNICIPAL DE JABOTICABA - RS,PM JABOTICABA - RS,92005560000157,96320.0,87934675000196,ERS-ESTADO DO RIO GRANDE DO SUL,96000.0,0,REGIAO SUL,12,ADMINISTRACAO DIRETA MUNICIPAL,E,M,True,True,2024-01-14T13:57:00
96631,PREFEITURA MUNICIPAL DE IBARAMA - RS,PM DE IBARAMA - RS,92000231000113,96320.0,87934675000196,ERS-ESTADO DO RIO GRANDE DO SUL,96000.0,0,REGIAO SUL,12,ADMINISTRACAO DIRETA MUNICIPAL,E,M,True,True,2024-01-14T13:57:00
96710,PREFEITURA MUNICIPAL DE PARAISO DO SUL - RS,PM PARAISO DO SUL,92000207000184,96320.0,87934675000196,ERS-ESTADO DO RIO GRANDE DO SUL,96000.0,0,REGIAO SUL,12,ADMINISTRACAO DIRETA MUNICIPAL,E,M,True,True,2024-01-14T13:57:00
85196,CAMARA MUNICIPAL DE CORONEL BICACO/RS,CM/COR.BICACO/RS,91997148000106,96320.0,87934675000196,ERS-ESTADO DO RIO GRANDE DO SUL,96000.0,0,REGIAO SUL,12,ADMINISTRACAO DIRETA MUNICIPAL,E,M,True,True,2024-04-17T11:03:00
96852,PREFEITURA MUNICIPAL DE VISTA GAUCHA - RS,PM VISTA GAUCHA-RS,91997072000100,96320.0,87934675000196,ERS-ESTADO DO RIO GRANDE DO SUL,96000.0,0,REGIAO SUL,12,ADMINISTRACAO DIRETA MUNICIPAL,E,M,True,True,2024-01-14T13:57:00
96807,PREFEITURA MUNICIPAL DE SEDE NOVA - RS,PM DE SEDE NOVA-RS,91997056000118,96320.0,87934675000196,ERS-ESTADO DO RIO GRANDE DO SUL,96000.0,0,REGIAO SUL,12,ADMINISTRACAO DIRETA MUNICIPAL,E,M,True,True,2024-01-14T13:57:00
96761,PREFEITURA MUNICIPAL DE SANTA TEREZA - RS,PM SANTA TEREZA-RS,91987719000113,96320.0,87934675000196,ERS-ESTADO DO RIO GRANDE DO SUL,96000.0,0,REGIAO SUL,12,ADMINISTRACAO DIRETA MUNICIPAL,E,M,True,True,2024-01-14T13:57:00
96529,PREFEITURA MUNICIPAL DE MONTE BELO DO SUL-RS,PM MONTE BELO D.SUL,91987669000174,96320.0,87934675000196,ERS-ESTADO DO RIO GRANDE DO SUL,96000.0,0,REGIAO SUL,12,ADMINISTRACAO DIRETA MUNICIPAL,E,M,True,True,2024-09-28T11:44:00
89263,PREFEITURA MUNICIPAL DE BARAO DO TRIUNFO/RS,PM/BARAO DO TRIUNFO,91900365000128,96320.0,87934675000196,ERS-ESTADO DO RIO GRANDE DO SUL,96000.0,0,REGIAO SUL,12,ADMINISTRACAO DIRETA MUNICIPAL,E,M,True,True,2025-07-17T10:12:00
86118,PREFEITURA MUNICIPAL DE BARAO/RS,PM/BARAO/RS,91693325000152,96320.0,87934675000196,ERS-ESTADO DO RIO GRANDE DO SUL,96000.0,0,REGIAO SUL,12,ADMINISTRACAO DIRETA MUNICIPAL,E,M,True,True,2024-11-06T16:27:00
96479,FUND.ESC.TECN.LIBERATO SALZANO VIEIRA D CUNHA,FU LIBERATO SALZANO,91683474000130,96697.0,88254875000160,PREFEITURA MUNICIPAL DE NOVO HAMBURGO - RS,96320.0,87934675000196,ERS-ESTADO DO RIO GRANDE DO SUL,4,FUNDACAO,E,E,True,True,2024-04-04T15:34:00
86931,PREFEITURA MUNICIPAL DE NOVA PRATA/RS,PMNP,91618439000138,96320.0,87934675000196,ERS-ESTADO DO RIO GRANDE DO SUL,96000.0,0,REGIAO SUL,12,ADMINISTRACAO DIRETA MUNICIPAL,E,M,True,True,2025-06-13T14:51:00
96644,PREFEITURA MUNICIPAL DE ITACURUBI - RS,PM DE ITACURUBI-RS,91573048000144,96320.0,87934675000196,ERS-ESTADO DO RIO GRANDE DO SUL,96000.0,0,REGIAO SUL,12,ADMINISTRACAO DIRETA MUNICIPAL,E,M,True,True,2024-01-14T13:57:00
96685,PREFEITURA MUNICIPAL DE NONOAI - RS,PM DE NONOAI - RS,91567974000107,96320.0,87934675000196,ERS-ESTADO DO RIO GRANDE DO SUL,96000.0,0,REGIAO SUL,12,ADMINISTRACAO DIRETA MUNICIPAL,E,M,True,True,2024-01-14T13:57:00
96611,PREFEITURA MUNICIPAL DE FAGUNDES VARELA - RS,PM FAGUNDES VARELA,91566893000192,96320.0,87934675000196,ERS-ESTADO DO RIO GRANDE DO SUL,96000.0,0,REGIAO SUL,12,ADMINISTRACAO DIRETA MUNICIPAL,E,M,True,True,2024-01-14T13:57:00
96731,PREFEITURA MUNICIPAL DE PROTÁSIO ALVES - RS,PM PROTÁSIO ALVES,91566885000146,96320.0,87934675000196,ERS-ESTADO DO RIO GRANDE DO SUL,96000.0,0,REGIAO SUL,12,ADMINISTRACAO DIRETA MUNICIPAL,E,M,True,True,2024-01-14T13:57:00
85915,PREFEITURA MUNICIPAL DE VILA FLORES/RS,PM/VILA FLORES/RS,91566869000153,96320.0,87934675000196,ERS-ESTADO DO RIO GRANDE DO SUL,96000.0,0,REGIAO SUL,12,ADMINISTRACAO DIRETA MUNICIPAL,E,M,True,True,2024-09-27T09:29:00
96679,PREFEITURA MUNICIPAL DE MORRO REDONDO - RS,PM MORRO REDONDO-RS,91558650000102,96320.0,87934675000196,ERS-ESTADO DO RIO GRANDE DO SUL,96000.0,0,REGIAO SUL,12,ADMINISTRACAO DIRETA MUNICIPAL,E,M,True,True,2024-01-14T13:57:00
26303,ESCOLA AGROTECNICA FEDERAL DE ALEGRETE,EAF/ALEGRETE,91551986000143,26000.0,00394445000101,MINISTERIO DA EDUCACAO,20101.0,00394411000109,PRESIDENCIA DA REPUBLICA,3,AUTARQUIA,E,F,True,True,2025-07-07T15:24:00
96669,PREFEITURA MUNICIPAL DE MANOEL VIANA - RS,PM MANOEL VIANA-RS,91551762000131,96320.0,87934675000196,ERS-ESTADO DO RIO GRANDE DO SUL,96000.0,0,REGIAO SUL,12,ADMINISTRACAO DIRETA MUNICIPAL,E,M,True,True,2024-01-14T13:57:00
96483,CAMARA MUNICIPAL DE ALEGRETE - RS,CM DE ALEGRETE-RS,91551119000108,96320.0,87934675000196,ERS-ESTADO DO RIO GRANDE DO SUL,96000.0,0,REGIAO SUL,12,ADMINISTRACAO DIRETA MUNICIPAL,,M,True,True,2024-01-13T13:57:00
96709,PREFEITURA MUNICIPAL DE PANTANO GRANDE - RS,PM PANTANO GRANDE,91342667000128,96320.0,87934675000196,ERS-ESTADO DO RIO GRANDE DO SUL,96000.0,0,REGIAO SUL,12,ADMINISTRACAO DIRETA MUNICIPAL,E,M,True,True,2024-01-14T13:57:00
38925,CONSELHO REGIONAL DE MEDICINA - RS,CRM-RS,91335315000145,38530.0,33583550000130,CONSELHO FEDERAL DE MEDICINA,36000.0,00394544000185,MINISTERIO DA SAUDE,3,AUTARQUIA,E,F,True,True,2023-03-29T14:15:00
86512,PREFEITURA MUNICIPAL DE PORTO VERA CRUZ/RS,PM/PORTO VERA CRUZ,91105452000193,96320.0,87934675000196,ERS-ESTADO DO RIO GRANDE DO SUL,96000.0,0,REGIAO SUL,12,ADMINISTRACAO DIRETA MUNICIPAL,E,M,True,True,2025-02-24T09:55:00
96494,PREFEITURA MUNICIPAL DE ARROIO DO SAL - RS,PM ARROIO DO SAL-RS,91103093000135,96320.0,87934675000196,ERS-ESTADO DO RIO GRANDE DO SUL,96000.0,0,REGIAO SUL,12,ADMINISTRACAO DIRETA MUNICIPAL,E,M,True,True,2024-01-13T13:57:00
29205,EMPRESA DE TRENS URBANOS DE PORTO ALEGRE S/A,TRENSURB S/A,90976853000156,56000.0,05465986000199,MINISTERIO DAS CIDADES,20101.0,00394411000109,PRESIDENCIA DA REPUBLICA,6,ECONOMIA MISTA,E,F,False,True,2007-11-30T23:00:00
96501,"DEPARTAMENTO DE AGUA,ARROIS E ESGOTO DE BAGÉ",DEP A.ESGOTO BAGE,90940172000138,96500.0,88073291000199,PREFEITURA MUNICIPAL DE BAGÉ - RS,96320.0,87934675000196,ERS-ESTADO DO RIO GRANDE DO SUL,3,AUTARQUIA,E,M,True,True,2024-04-03T16:14:00
86576,CAMARA MUNICIPAL DE OSORIO/RS,CM/OSORIO/RS,90938143000131,96320.0,87934675000196,ERS-ESTADO DO RIO GRANDE DO SUL,96000.0,0,REGIAO SUL,12,ADMINISTRACAO DIRETA MUNICIPAL,E,M,True,True,2025-03-18T11:30:00
96744,PREFEITURA MUNICIPAL DE ROLANTE - RS,PM DE ROLANTE - RS,90936956000192,96320.0,87934675000196,ERS-ESTADO DO RIO GRANDE DO SUL,96000.0,0,REGIAO SUL,12,ADMINISTRACAO DIRETA MUNICIPAL,E,M,True,True,2024-01-14T13:57:00
96578,PREFEITURA MUNICIPAL DE COTIPORÃ - RS,PM DE COTIPORÃ - RS,90898487000164,96320.0,87934675000196,ERS-ESTADO DO RIO GRANDE DO SUL,96000.0,0,REGIAO SUL,12,ADMINISTRACAO DIRETA MUNICIPAL,E,M,True,True,2024-01-14T13:57:00
96677,PREFEITURA MUNICIPAL DE MONTENEGRO - RS,PM MONTENEGRO-RS,90895905000160,96320.0,87934675000196,ERS-ESTADO DO RIO GRANDE DO SUL,96000.0,0,REGIAO SUL,12,ADMINISTRACAO DIRETA MUNICIPAL,E,M,True,True,2024-01-14T13:57:00
96775,CÂMARA MUNICIPAL DE SÃO JERÔNIMO - RS,CM SÃO JERONIMO-RS,90893439000183,96320.0,87934675000196,ERS-ESTADO DO RIO GRANDE DO SUL,96000.0,0,REGIAO SUL,12,ADMINISTRACAO DIRETA MUNICIPAL,,M,True,True,2024-01-14T13:57:00
38771,CONSELHO REGIONAL DE SERVIÇO SOCIAL 10ª - RS,CRESS10-RS,90890427000103,,,,,,,3,AUTARQUIA,E,F,True,True,2023-10-17T15:47:00
96514,PREFEITURA MUNICIPAL DE BOM PRINCIPIO - RS,PM BOM PRINCIPIO/RS,90873787000199,96320.0,87934675000196,ERS-ESTADO DO RIO GRANDE DO SUL,96000.0,0,REGIAO SUL,12,ADMINISTRACAO DIRETA MUNICIPAL,E,M,True,True,2024-01-13T13:57:00
96705,PREFEITURA MUNICIPAL DE PALMARES DO SUL - RS,PM PALMARES DO SUL,90836701000158,96320.0,87934675000196,ERS-ESTADO DO RIO GRANDE DO SUL,96000.0,0,REGIAO SUL,12,ADMINISTRACAO DIRETA MUNICIPAL,E,M,True,True,2024-01-14T13:57:00
96547,PREFEITURA MUNICIPAL DE CAPAO DA CANOA - RS,PM CAPAO DA CANOA,90836693000140,96320.0,87934675000196,ERS-ESTADO DO RIO GRANDE DO SUL,96000.0,0,REGIAO SUL,12,ADMINISTRACAO DIRETA MUNICIPAL,E,M,True,True,2024-01-13T13:57:00
96527,PREFEITURA MUNICIPAL DE CAMPO BOM - RS,PM DE CAMPO BOM-RS,90832619000155,96320.0,87934675000196,ERS-ESTADO DO RIO GRANDE DO SUL,96000.0,0,REGIAO SUL,12,ADMINISTRACAO DIRETA MUNICIPAL,E,M,True,True,2024-01-13T13:57:00
96409,CAMARA MUNICIPAL DE GUAÍBA - RS,CM DE GUAÍBA RS,90829888000162,96320.0,87934675000196,ERS-ESTADO DO RIO GRANDE DO SUL,96000.0,0,REGIAO SUL,12,ADMINISTRACAO DIRETA MUNICIPAL,E,M,True,True,2023-02-14T16:10:00
38793,CONSELHO REG.DE FIS. E TERAPIA OCUPACIONAL-RS,CREFITO5-RS,90601147000120,38885.0,00487140000136,CONSELHO FEDERAL FISIOT. TERAPIA OCUPACIONAL,38000.0,37115367000160,MINISTERIO DO TRABALHO E EMPREGO,3,AUTARQUIA,E,F,True,True,2023-03-16T17:22:00
96640,PREFEITURA MUNICIPAL DE IPE - RS,PM DE IPE - RS,90544511000167,96320.0,87934675000196,ERS-ESTADO DO RIO GRANDE DO SUL,96000.0,0,REGIAO SUL,12,ADMINISTRACAO DIRETA MUNICIPAL,E,M,True,True,2024-01-14T13:57:00
85166,PREFEITURA MUNICIPAL SANTO EXPEDITO DO SUL,PMSES/RS,90484296000156,96320.0,87934675000196,ERS-ESTADO DO RIO GRANDE DO SUL,96000.0,0,REGIAO SUL,12,ADMINISTRACAO DIRETA MUNICIPAL,E,M,True,True,2024-04-10T16:57:00
96820,PREFEITURA MUNICIPAL DE TERRA DE AREIA - RS,PM TERRA DE AREIA,90256660000120,96320.0,87934675000196,ERS-ESTADO DO RIO GRANDE DO SUL,96000.0,0,REGIAO SUL,12,ADMINISTRACAO DIRETA MUNICIPAL,E,M,True,True,2024-01-14T13:57:00
96638,PREFEITURA MUNICIPAL DE IMBE - RS,PM DE IMBE - RS,90256652000184,96320.0,87934675000196,ERS-ESTADO DO RIO GRANDE DO SUL,96000.0,0,REGIAO SUL,12,ADMINISTRACAO DIRETA MUNICIPAL,E,M,True,True,2024-01-14T13:57:00
96676,PREFEITURA MUNICIPAL DE MONTAURI - RS,PM DE MONTAURI - RS,90221565000191,96320.0,87934675000196,ERS-ESTADO DO RIO GRANDE DO SUL,96000.0,0,REGIAO SUL,12,ADMINISTRACAO DIRETA MUNICIPAL,E,M,True,True,2024-01-14T13:57:00
96707,CAMARA MUNICIPAL DE PANAMBI - RS,CM DE PANAMB - RS,90163445000185,96320.0,87934675000196,ERS-ESTADO DO RIO GRANDE DO SUL,96000.0,0,REGIAO SUL,12,ADMINISTRACAO DIRETA MUNICIPAL,,M,True,True,2024-01-14T13:57:00
96581,PREFEITURA MUNICIPAL DE CRISTAL - RS,PM DE CRISTAL - RS,90152240000102,96320.0,87934675000196,ERS-ESTADO DO RIO GRANDE DO SUL,96000.0,0,REGIAO SUL,12,ADMINISTRACAO DIRETA MUNICIPAL,E,M,True,True,2024-01-14T13:57:00
