codigoOrgao,nomeOrgao,nomeMnemonicoOrgao,cnpjCpfOrgao,codigoOrgaoVinculado,cnpjCpfOrgaoVinculado,nomeOrgaoVinculado,codigoOrgaoSuperior,cnpjCpfOrgaoSuperior,nomeOrgaoSuperior,codigoTipoAdministracao,nomeTipoAdministracao,poder,esfera,usoSisg,statusOrgao,dataHoraMovimento
96845,PREFEITURA MUNICIPAL DE VERANOPOLIS - RS,PM VERANOPOLIS - RS,98671597000109,96320.0,87934675000196,ERS-ESTADO DO RIO GRANDE DO SUL,96000.0,0,REGIAO SUL,12,ADMINISTRACAO DIRETA MUNICIPAL,E,M,True,True,2024-01-14T13:57:00
96829,SETREM - SOC. EDUC. TRÊS DE MAIO,SOC E.TRES DE MAIO,98039852000600,96828.0,87612800000141,PREFEITURA MUNICIPAL DE TRÊS DE MAIO - RS,96320.0,87934675000196,ERS-ESTADO DO RIO GRANDE DO SUL,15,EMPRESA PRIVADA,E,M,True,True,2024-04-01T15:42:00
96817,PREFEITURA MUNICIPAL DE TAQUARA - RS,PM DE TAQUARA - RS,97761407000173,96320.0,87934675000196,ERS-ESTADO DO RIO GRANDE DO SUL,96000.0,0,REGIAO SUL,12,ADMINISTRACAO DIRETA MUNICIPAL,E,M,True,True,2024-01-14T13:57:00
87031,FUNDO MUNICIPAL DE SAUDE ARARI,FMS/ARARI,97552407000163,,,,,,,7,FUNDOS,E,M,True,True,2024-08-03T13:57:00
87643,FUNDO MUNICIPAL DE SAUDE JAÍBA,FMS/JAÍBA,97552158000106,,,,,,,7,FUNDOS,E,M,True,True,2024-08-11T13:57:00
88252,FUNDO M. S. SANTA CRUZ DA CONCEIÇÃO,FMS,97552000000136,,,,,,,7,FUNDOS,E,M,True,True,2024-08-24T13:57:00
87455,FUNDO MUNICIPAL DE SAUDE TASSO FRAGOSO,FMS/TASSO FRAGOSO,97551531000104,,,,,,,7,FUNDOS,E,M,True,True,2024-08-10T13:57:00
95161,EMG - CONSORCIO INTER.ALIANÇA PARA A SAUDE,CIAS - MG,97550393000149,95120.0,18715615000160,EMG-ESTADO DE MINAS GERAIS,95000.0,0,REGIAO SUDESTE,5,EMPRESA PUBLICA COMERCIAL E FINANCEIRA,E,E,True,True,2023-09-03T11:44:00
87550,FUNDO MUNICIPAL DE SAUDE GOIABEIRA,FMS/GOIABEIRA,97550158000177,,,,,,,7,FUNDOS,E,M,True,True,2024-08-10T13:57:00
87424,FUNDO MUNICIPAL DE SAUDE BACURI,FMS/BACURI,97546561000122,,,,,,,7,FUNDOS,E,M,True,True,2024-08-10T13:57:00
87901,FUNDO MUNICIPAL DE SAUDE RIBEIRA DO PIAUÍ,FMS,97545970000104,,,,,,,7,FUNDOS,E,M,True,True,2024-08-17T13:57:00
88216,FUNDO MUNICIPAL DE SAUDE SALTO GRANDE,FMS/SALTO GRANDE,97536392000140,96065.0,46211686000160,PREFEITURA MUNICIPAL DE SALTO GRANDE - SP,95420.0,46379400000150,ESP-ESTADO DE SÃO PAULO,7,FUNDOS,E,M,True,True,2024-08-24T13:57:00
87576,FUNDO MUNICIPAL DE SAUDE MINAS NOVAS,FMS/MINAS NOVAS,97535949000128,,,,,,,7,FUNDOS,E,M,True,True,2024-08-10T13:57:00
88000,FUNDO MUNICIPAL DE SAUDE REDENTORA,FMS/REDENTORA,97531256000167,,,,,,,7,FUNDOS,E,M,True,True,2024-08-18T13:57:00
87025,FUNDO MUNICIPAL DE SAUDE ATALAIA DO NORTE,FMS,97531081000198,,,,,,,7,FUNDOS,E,M,True,True,2024-08-03T13:57:00
87508,FUNDO M. S. SÃO FÉLIX DO ARAGUAIA,FMS,97530840000106,,,,,,,7,FUNDOS,E,M,True,True,2024-08-10T13:57:00
88231,FUNDO MUNICIPAL DE SAUDE SARAPUÍ,FMS/SARAPUÍ,97530536000150,98642.0,46634341000110,PREFEITURA MUNICIPAL DE SARAPUI - SP,95420.0,46379400000150,ESP-ESTADO DE SÃO PAULO,7,FUNDOS,E,M,True,True,2024-08-24T13:57:00
87499,FUNDO MUNICIPAL DE SAUDE NOVA SANTA HELENA,FMS,97523172000181,,,,,,,7,FUNDOS,E,M,True,True,2024-08-10T13:57:00
88163,FUNDO MUNICIPAL DE SAUDE JOANÓPOLIS,FMS/JOANÓPOLIS,97522485000115,95881.0,45290418000119,PREFEITURA MUNICIPAL DE JOANOPOLIS - SP,95420.0,46379400000150,ESP-ESTADO DE SÃO PAULO,7,FUNDOS,E,M,True,True,2024-08-18T13:57:00
87922,FUNDO MUNICIPAL DE SAUDE GALINHOS,FMS/GALINHOS,97521878000104,,,,,,,7,FUNDOS,E,M,True,True,2024-08-17T13:57:00
88211,FUNDO MUNICIPAL DE SAUDE REGINÓPOLIS,FMS/REGINÓPOLIS,97520643000106,96037.0,44556033000198,PREFEITURA MUNICIPAL DE REGINOPOLIS - SP,95420.0,46379400000150,ESP-ESTADO DE SÃO PAULO,7,FUNDOS,E,M,True,True,2024-08-24T13:57:00
88205,FUNDO MUNICIPAL DE SAUDE POPULINA,FMS/POPULINA,97520318000135,,,,,,,7,FUNDOS,E,M,True,True,2024-08-24T13:57:00
87719,FUNDO MUNICIPAL DE SAUDE SERRA REDONDA,FMS/SERRA REDONDA,97519352000190,,,,,,,7,FUNDOS,E,M,True,True,2024-08-11T13:57:00
94851,FUND. DE APOIO A PESQ. E EXTENSÃO DE SERGIPE,FAPESE - SE,97500037000110,94820.0,13128798000101,ESE-ESTADO DE SERGIPE,94000.0,0,REGIAO NORDESTE,4,FUNDACAO,E,E,True,True,2024-05-16T13:57:00
85220,CÂMARA MUNICIPAL DE VERA CRUZ DO OESTE/PR,CMVCO/PR,97442677000111,96120.0,76416940000128,EPR-ESTADO DO PARANÁ,96000.0,0,REGIAO SUL,12,ADMINISTRACAO DIRETA MUNICIPAL,E,M,True,True,2024-04-23T15:57:00
96342,SECRETARIA DA ADM. E DOS RECURSOS HUMANOS,SEC.DIR.HUMANOS,97383210000148,96330.0,92963560000160,PREFEITURA MUNICIPAL DE PORTO ALEGRE - RS,96320.0,87934675000196,ERS-ESTADO DO RIO GRANDE DO SUL,12,ADMINISTRACAO DIRETA MUNICIPAL,E,M,True,True,2024-01-13T13:57:00
96801,PREFEITURA MUNICIPAL DE SAO SEPE - RS,PM DE SAO SEPE - RS,97229181000164,96320.0,87934675000196,ERS-ESTADO DO RIO GRANDE DO SUL,96000.0,0,REGIAO SUL,12,ADMINISTRACAO DIRETA MUNICIPAL,E,M,True,True,2024-01-14T13:57:00
96620,PREFEITURA MUNICIPAL DE FORMIGUEIRO - RS,PM FORMIGUEIRO - RS,97228126000150,96320.0,87934675000196,ERS-ESTADO DO RIO GRANDE DO SUL,96000.0,0,REGIAO SUL,12,ADMINISTRACAO DIRETA MUNICIPAL,E,M,True,True,2024-01-14T13:57:00
85313,SERVIÇO MUN.PREV.SOCIAL DE F.DA ROCHA/SP,SEPREV/SP,96493648000116,95420.0,46379400000150,ESP-ESTADO DE SÃO PAULO,95000.0,0,REGIAO SUDESTE,12,ADMINISTRACAO DIRETA MUNICIPAL,E,M,True,True,2024-05-15T08:37:00
86543,INSTITUTO DE PREV.DOS SER.MUN.SAO J.DOS CAMPO,IPSM/S.J.DOS CAMPOS,96490479000160,95420.0,46379400000150,ESP-ESTADO DE SÃO PAULO,95000.0,0,REGIAO SUDESTE,14,ADMINISTRACAO INDIRETA MUNICIPAL,E,M,True,True,2025-02-28T10:55:00
85625,INSTITUTO DE PREV.DO MUNICIPIO DE JACAREI/SP,IPM/JACAREI/SP,96484134000102,95420.0,46379400000150,ESP-ESTADO DE SÃO PAULO,95000.0,0,REGIAO SUDESTE,14,ADMINISTRACAO INDIRETA MUNICIPAL,E,M,True,True,2024-08-13T15:31:00
95603,ESP-SECRETARIA DE PARCERIAS EM INVESTIMENTOS,SEC. PAR. INVEST,96480850000103,95420.0,46379400000150,ESP-ESTADO DE SÃO PAULO,95000.0,0,REGIAO SUDESTE,11,ADMINISTRACAO DIRETA ESTADUAL,E,E,True,True,2023-04-19T14:30:00
95602,ESP-SECRETARIA ADMINISTRACAO PENITENCIARIA,SEC. ADMIN. PENIT.,96291141000180,95420.0,46379400000150,ESP-ESTADO DE SÃO PAULO,95000.0,0,REGIAO SUDESTE,11,ADMINISTRACAO DIRETA ESTADUAL,E,E,True,True,2023-04-19T14:29:00
99292,PREFEITURA MUNICIPAL DE VARGEM BONITA - SC,PM VARGEM BONITA-SC,95996187000131,96220.0,82951229000176,ESC-ESTADO DE SANTA CATARINA,96000.0,0,REGIAO SUL,12,ADMINISTRACAO DIRETA MUNICIPAL,E,M,True,True,2024-01-21T13:57:00
96294,CÂMARA MUNICIPAL DE ARABUTÃ - SC,CM DE ARABUTÃ - SC,95995254000101,96220.0,82951229000176,ESC-ESTADO DE SANTA CATARINA,96000.0,0,REGIAO SUL,12,ADMINISTRACAO DIRETA MUNICIPAL,,M,True,True,2024-01-13T13:57:00
99291,PREFEITURA MUNICIPAL DE VARGEM - SC,PM DE VARGEM - SC,95995130000118,96220.0,82951229000176,ESC-ESTADO DE SANTA CATARINA,96000.0,0,REGIAO SUL,12,ADMINISTRACAO DIRETA MUNICIPAL,E,M,True,True,2024-01-21T13:57:00
99114,PREFEITURA MUNICIPAL DE CORONEL MARTIN - SC,PM CEL. MARTIN - SC,95993093000109,96220.0,82951229000176,ESC-ESTADO DE SANTA CATARINA,96000.0,0,REGIAO SUL,12,ADMINISTRACAO DIRETA MUNICIPAL,E,M,True,True,2024-01-21T13:57:00
99178,PREFEITURA MUNICIPAL DE LAJEADO GRANDE - SC,PM LAJEADO GRANDE,95993077000116,96220.0,82951229000176,ESC-ESTADO DE SANTA CATARINA,96000.0,0,REGIAO SUL,12,ADMINISTRACAO DIRETA MUNICIPAL,E,M,True,True,2024-01-21T13:57:00
86965,PREFEITURA MUNICIPAL DE IPUAÇU/SC,PMI/SC,95993028000183,96220.0,82951229000176,ESC-ESTADO DE SANTA CATARINA,96000.0,0,REGIAO SUL,12,ADMINISTRACAO DIRETA MUNICIPAL,E,M,True,True,2025-06-23T16:32:00
99187,PREFEITURA MUNICIPAL DE MACIEIRA - SC,PM DE MACIEIRA - SC,95992020000100,96220.0,82951229000176,ESC-ESTADO DE SANTA CATARINA,96000.0,0,REGIAO SUL,12,ADMINISTRACAO DIRETA MUNICIPAL,E,M,True,True,2024-01-21T13:57:00
99799,PREFEITURA MUNICIPAL DE CERRO NEGRO - SC,PM CERRO NEGRO - SC,95991097000158,96220.0,82951229000176,ESC-ESTADO DE SANTA CATARINA,96000.0,0,REGIAO SUL,12,ADMINISTRACAO DIRETA MUNICIPAL,E,M,True,True,2024-09-28T11:44:00
99239,PREFEITURA MUNICIPAL DE RIO RUFINO - SC,PM DE RIO RUFINO-SC,95991071000100,96220.0,82951229000176,ESC-ESTADO DE SANTA CATARINA,96000.0,0,REGIAO SUL,12,ADMINISTRACAO DIRETA MUNICIPAL,E,M,True,True,2024-01-21T13:57:00
96282,PREFEITURA MUNICIPAL DE PLANALTO ALEGRE - SC,PM PLANALTO ALEGRE,95990255000155,96220.0,82951229000176,ESC-ESTADO DE SANTA CATARINA,96000.0,0,REGIAO SUL,12,ADMINISTRACAO DIRETA MUNICIPAL,E,M,True,True,2024-01-13T13:57:00
99153,PREFEITURA MUNICIPAL DE IRATI - SC,PM DE IRATI - SC,95990230000151,96220.0,82951229000176,ESC-ESTADO DE SANTA CATARINA,96000.0,0,REGIAO SUL,12,ADMINISTRACAO DIRETA MUNICIPAL,E,M,True,True,2024-01-21T13:57:00
99143,PREFEITURA MUNICIPAL DE GUATAMBU - SC,PM DE GUATAMBU - SC,95990206000112,96220.0,82951229000176,ESC-ESTADO DE SANTA CATARINA,96000.0,0,REGIAO SUL,12,ADMINISTRACAO DIRETA MUNICIPAL,E,M,True,True,2024-01-21T13:57:00
99113,PREFEITURA MUNICIPAL DE CORDILHEIRA ALTA - SC,PM CORDILHEIRA ALTA,95990198000104,96220.0,82951229000176,ESC-ESTADO DE SANTA CATARINA,96000.0,0,REGIAO SUL,12,ADMINISTRACAO DIRETA MUNICIPAL,E,M,True,True,2024-01-21T13:57:00
99207,PREFEITURA MUNICIPAL DE NOVO HORIZONTE - SC,PM  NOVO HORIZONTE,95990115000187,96220.0,82951229000176,ESC-ESTADO DE SANTA CATARINA,96000.0,0,REGIAO SUL,12,ADMINISTRACAO DIRETA MUNICIPAL,E,M,True,True,2024-01-21T13:57:00
99281,PREFEITURA MUNICIPAL DE SUL BRASIL - SC,PM DE SUL BRASIL-SC,95990107000130,96220.0,82951229000176,ESC-ESTADO DE SANTA CATARINA,96000.0,0,REGIAO SUL,12,ADMINISTRACAO DIRETA MUNICIPAL,E,M,True,True,2024-01-21T13:57:00
86655,CÂMARA DE VEREADORES SÃO JOÃO DO ITAPERIU/ SC,CMVSJI,95954467000187,96220.0,82951229000176,ESC-ESTADO DE SANTA CATARINA,96000.0,0,REGIAO SUL,14,ADMINISTRACAO INDIRETA MUNICIPAL,E,M,True,True,2025-04-07T16:44:00
99262,PREFEITURA MUNICIPAL SÃO JOÃO DO ITAPERIÚ-SC,PM S.JOÃO ITAPERIÚ,95954442000183,96220.0,82951229000176,ESC-ESTADO DE SANTA CATARINA,96000.0,0,REGIAO SUL,12,ADMINISTRACAO DIRETA MUNICIPAL,E,M,True,True,2024-01-21T13:57:00
99246,PREFEITURA MUNICIPAL DE SANTA TEREZINHA - SC,SANTA TEREZINHA-SC,95951323000177,96220.0,82951229000176,ESC-ESTADO DE SANTA CATARINA,96000.0,0,REGIAO SUL,12,ADMINISTRACAO DIRETA MUNICIPAL,E,M,True,True,2024-01-21T13:57:00
99797,PREFEITURA MUNICIPAL DE CALMON - SC,PM DE CALMON - SC,95949806000137,96220.0,82951229000176,ESC-ESTADO DE SANTA CATARINA,96000.0,0,REGIAO SUL,12,ADMINISTRACAO DIRETA MUNICIPAL,E,M,True,True,2024-09-28T11:44:00
99805,CAMARA MUNICIPAL DE LAGUNA - SC,CM DE LAGUNA - SC,95788840000177,96220.0,82951229000176,ESC-ESTADO DE SANTA CATARINA,96000.0,0,REGIAO SUL,12,ADMINISTRACAO DIRETA MUNICIPAL,,M,True,True,2024-09-28T11:44:00
99217,PREFEITURA MUNICIPAL DE PASSO DE TORRES - SC,PM PASSO TORRES-SC,95782793000154,96220.0,82951229000176,ESC-ESTADO DE SANTA CATARINA,96000.0,0,REGIAO SUL,12,ADMINISTRACAO DIRETA MUNICIPAL,E,M,True,True,2024-01-21T13:57:00
96206,PREFEITURA MUNICIPAL DE ITAIPULÃNDIA - PR,PM ITAIPULÃNDIA-PR,95725057000164,96120.0,76416940000128,EPR-ESTADO DO PARANÁ,96000.0,0,REGIAO SUL,12,ADMINISTRACAO DIRETA MUNICIPAL,E,M,True,True,2024-09-28T11:44:00
97945,PREFEITURA DE ENTRE RIOS DO OESTE - PR,PM ENTRE RIOS OESTE,95719449000110,96120.0,76416940000128,EPR-ESTADO DO PARANÁ,96000.0,0,REGIAO SUL,12,ADMINISTRACAO DIRETA MUNICIPAL,E,M,True,True,2023-06-16T14:18:00
97932,PREFEITURA DE MERCEDES - PR,PM MERCEDES - PR,95719373000123,96120.0,76416940000128,EPR-ESTADO DO PARANÁ,96000.0,0,REGIAO SUL,12,ADMINISTRACAO DIRETA MUNICIPAL,E,M,True,True,2023-06-15T16:58:00
98158,CAMARA MUNICIPAL DE CANDÓI - PR,CM DE CANDÓI - PR,95684486000130,96120.0,76416940000128,EPR-ESTADO DO PARANÁ,96000.0,0,REGIAO SUL,12,ADMINISTRACAO DIRETA MUNICIPAL,,M,True,True,2024-01-20T13:57:00
97969,PREFEITURA DE CANDÓI - PR,PM CANDÓI - PR,95684478000194,96120.0,76416940000128,EPR-ESTADO DO PARANÁ,96000.0,0,REGIAO SUL,12,ADMINISTRACAO DIRETA MUNICIPAL,E,M,True,True,2023-06-26T15:03:00
85275,PREFEITURA MUNICIPAL DE ÂNGULO,PMA,95642286000115,96120.0,76416940000128,EPR-ESTADO DO PARANÁ,96000.0,0,REGIAO SUL,12,ADMINISTRACAO DIRETA MUNICIPAL,E,M,True,True,2024-05-06T13:50:00
98153,CAMARA MUNICIPAL DE CAFEZAL DO SUL,CAMARA,95640793000110,96120.0,76416940000128,EPR-ESTADO DO PARANÁ,96000.0,0,REGIAO SUL,12,ADMINISTRACAO DIRETA MUNICIPAL,,M,True,True,2024-03-15T12:16:00
97972,PREFEITURA DE CAFEZAL DO SUL - PR,PM CAFEZAL DO SUL,95640652000105,96120.0,76416940000128,EPR-ESTADO DO PARANÁ,96000.0,0,REGIAO SUL,12,ADMINISTRACAO DIRETA MUNICIPAL,E,M,True,True,2023-06-26T14:59:00
98048,PREFEITURA MUNICIPAL DE BRASILÂNDIA DO SUL-PR,PM BRASILÃNDIA SUL,95640520000175,96120.0,76416940000128,EPR-ESTADO DO PARANÁ,96000.0,0,REGIAO SUL,12,ADMINISTRACAO DIRETA MUNICIPAL,E,M,True,True,2024-09-03T15:34:00
89249,CÂMARA MUNICIPAL DE JANIÓPOLIS/PR,CMJ/PR,95640223000120,96120.0,76416940000128,EPR-ESTADO DO PARANÁ,96000.0,0,REGIAO SUL,14,ADMINISTRACAO INDIRETA MUNICIPAL,E,M,True,True,2025-07-15T10:20:00
98107,CAMARA MUNICIPAL DE MANDAGUARÍ - PR,CM MANDAGUARÍ - PR,95639548000192,96120.0,76416940000128,EPR-ESTADO DO PARANÁ,96000.0,0,REGIAO SUL,12,ADMINISTRACAO DIRETA MUNICIPAL,E,M,True,True,2024-09-03T15:53:00
96213,PREFEITURA MUNICIPAL DE NOVO ITACOLOMI - PR,PM NOVO ITACOLOMI,95639472000103,96120.0,76416940000128,EPR-ESTADO DO PARANÁ,96000.0,0,REGIAO SUL,12,ADMINISTRACAO DIRETA MUNICIPAL,E,M,True,True,2024-09-28T11:44:00
98022,PREFEITURA DE IGUATU - PR,PM IGUATU - PR,95595013000167,96120.0,76416940000128,EPR-ESTADO DO PARANÁ,96000.0,0,REGIAO SUL,12,ADMINISTRACAO DIRETA MUNICIPAL,E,M,True,True,2023-06-27T16:26:00
98063,PREFEITURA MUNICIPAL DE ANAHY - PR,PM ANAHY - PR,95594800000194,96120.0,76416940000128,EPR-ESTADO DO PARANÁ,96000.0,0,REGIAO SUL,12,ADMINISTRACAO DIRETA MUNICIPAL,E,M,True,True,2024-09-03T15:30:00
26247,UNIVERSIDADE FEDERAL DE SANTA MARIA,UFSM,95591764000105,26000.0,00394445000101,MINISTERIO DA EDUCACAO,20101.0,00394411000109,PRESIDENCIA DA REPUBLICA,3,AUTARQUIA,E,F,True,True,2025-07-07T15:17:00
98135,PREFEITURA MUNICIPAL DE PINHAL DE SÃO BENTO,PM PINHAL S.BENTO,95590832000111,96120.0,76416940000128,EPR-ESTADO DO PARANÁ,96000.0,0,REGIAO SUL,12,ADMINISTRACAO DIRETA MUNICIPAL,E,M,True,True,2024-09-03T15:57:00
98220,CAMARA NUNICIPAL DE CRUZEIRO DO IGUACU - PR,CM CRUZEIRO IGUACU,95589370000112,96120.0,76416940000128,EPR-ESTADO DO PARANÁ,96000.0,0,REGIAO SUL,12,ADMINISTRACAO DIRETA MUNICIPAL,,M,True,True,2024-01-20T13:57:00
98228,PREFEITURA DE NOVA ESPERANÇA DO SUDOESTE - PR,PM N.ESPER.SUDOESTE,95589289000132,96120.0,76416940000128,EPR-ESTADO DO PARANÁ,96000.0,0,REGIAO SUL,12,ADMINISTRACAO DIRETA MUNICIPAL,E,M,True,True,2024-01-20T13:57:00
97973,PREFEITURA DE FLOR DA SERRA DO SUL - PR,PM FLOR SERRA SUL,95589271000130,96120.0,76416940000128,EPR-ESTADO DO PARANÁ,96000.0,0,REGIAO SUL,12,ADMINISTRACAO DIRETA MUNICIPAL,E,M,True,True,2023-06-26T15:02:00
98092,PREFEITURA DE BOA ESPERANÇA DO IGUAÇU - PR,PM BOA ESP.IGUAÇU,95589255000148,96120.0,76416940000128,EPR-ESTADO DO PARANÁ,96000.0,0,REGIAO SUL,12,ADMINISTRACAO DIRETA MUNICIPAL,E,M,True,True,2023-08-04T10:49:00
97993,PREFEITURA DE CRUZEIRO DO IGUACU - PR,PM CRUZEIRO IGUACU,95589230000144,96120.0,76416940000128,EPR-ESTADO DO PARANÁ,96000.0,0,REGIAO SUL,12,ADMINISTRACAO DIRETA MUNICIPAL,E,M,True,True,2023-06-26T15:52:00
98251,CAMARA MUNICIPAL DE VIRMOND - PR,CM DE VIRMOND - PR,95587689000109,96120.0,76416940000128,EPR-ESTADO DO PARANÁ,96000.0,0,REGIAO SUL,12,ADMINISTRACAO DIRETA MUNICIPAL,,M,True,True,2024-01-20T13:57:00
98024,PREFEITURA DE NOVA LARANJEIRAS - PR,PM NOVA LARANJEIRAS,95587648000112,96120.0,76416940000128,EPR-ESTADO DO PARANÁ,96000.0,0,REGIAO SUL,12,ADMINISTRACAO DIRETA MUNICIPAL,E,M,True,True,2023-06-27T16:29:00
97977,PREFEITURA DE HONORIO SERPA - PR,PM HONORIO SERPA-PR,95585444000142,96120.0,76416940000128,EPR-ESTADO DO PARANÁ,96000.0,0,REGIAO SUL,12,ADMINISTRACAO DIRETA MUNICIPAL,E,M,True,True,2023-06-26T15:10:00
98006,PREFEITURA DE SÃO PEDRO DO IGUAÇU - PR,PM S.PEDRO IGUACU,95583597000150,96120.0,76416940000128,EPR-ESTADO DO PARANÁ,96000.0,0,REGIAO SUL,12,ADMINISTRACAO DIRETA MUNICIPAL,E,M,True,True,2023-06-26T16:18:00
97943,PREFEITURA DE MARIPÁ - PR,PM MARIPÁ - PR,95583571000102,96120.0,76416940000128,EPR-ESTADO DO PARANÁ,96000.0,0,REGIAO SUL,12,ADMINISTRACAO DIRETA MUNICIPAL,E,M,True,True,2023-06-16T14:14:00
89080,MPR-CAMARA MUNICIPAL DE PRIMEIRO DE MAIO,CM PRIMEIRO DE MAIO,95561965000160,96120.0,76416940000128,EPR-ESTADO DO PARANÁ,96000.0,0,REGIAO SUL,12,ADMINISTRACAO DIRETA MUNICIPAL,,M,True,True,2025-05-25T15:40:00
98211,CAMARA MUNICIPAL DE NOVA SANTA BARBARA - PR,CM N. SANTA BARBARA,95561809000107,96120.0,76416940000128,EPR-ESTADO DO PARANÁ,96000.0,0,REGIAO SUL,12,ADMINISTRACAO DIRETA MUNICIPAL,,M,True,True,2024-01-20T13:57:00
98023,PREFEITURA DE NOVA SANTA BARBARA - PR,PM NOVA STA.BARBARA,95561080000160,96120.0,76416940000128,EPR-ESTADO DO PARANÁ,96000.0,0,REGIAO SUL,12,ADMINISTRACAO DIRETA MUNICIPAL,E,M,True,True,2023-06-27T16:27:00
89079,MPR-PREFEITURA MUNICIPAL DE PITANGUEIRAS,PM PITANGUEIRAS-PR,95543427000142,96120.0,76416940000128,EPR-ESTADO DO PARANÁ,96000.0,0,REGIAO SUL,12,ADMINISTRACAO DIRETA MUNICIPAL,E,M,True,True,2025-05-25T15:40:00
96753,PREFEITURA MUNICIPAL DE SANTA CRUZ DO SUL-RS,PM SANTA CRUZ  SUL,95440517000108,96320.0,87934675000196,ERS-ESTADO DO RIO GRANDE DO SUL,96000.0,0,REGIAO SUL,12,ADMINISTRACAO DIRETA MUNICIPAL,E,M,True,True,2024-01-14T13:57:00
97994,PREFEITURA DE PINHAIS - PR,PM DE PINHAIS - PR,95423000000100,96120.0,76416940000128,EPR-ESTADO DO PARANÁ,96000.0,0,REGIAO SUL,12,ADMINISTRACAO DIRETA MUNICIPAL,E,M,True,True,2023-06-26T15:54:00
97917,PREFEITURA DE FAZENDA RIO GRANDE - PR,PM FAZENDA GRANDE,95422986000102,96120.0,76416940000128,EPR-ESTADO DO PARANÁ,96000.0,0,REGIAO SUL,12,ADMINISTRACAO DIRETA MUNICIPAL,E,M,True,True,2023-06-15T16:29:00
96216,CAMARA MUNICIPAL DE PINHAIS - PR,CM DE PINHAIS - PR,95422903000177,96120.0,76416940000128,EPR-ESTADO DO PARANÁ,96000.0,0,REGIAO SUL,12,ADMINISTRACAO DIRETA MUNICIPAL,,M,True,True,2024-09-28T11:44:00
98242,PREFEITURA MUNICIPAL DE ITAPERUÇU - PR,PM  ITAPERUÇU - PR,95422846000126,96120.0,76416940000128,EPR-ESTADO DO PARANÁ,96000.0,0,REGIAO SUL,12,ADMINISTRACAO DIRETA MUNICIPAL,E,M,True,True,2024-01-20T13:57:00
96859,FUNDAÇÃO MUNICIPAL DE MEIO AMBIENTE-GRAVATAI,FM DE MEIO AMBIENTE,94955275000122,96628.0,87890992000158,PREFEITURA MUNICIPAL DE GRAVATAI - RS,96320.0,87934675000196,ERS-ESTADO DO RIO GRANDE DO SUL,4,FUNDACAO,E,M,True,True,2024-01-14T13:57:00
26273,FUNDACAO UNIVERSIDADE DO RIO GRANDE - RS,FU-RIO GRANDE-RS,94877586000110,26000.0,00394445000101,MINISTERIO DA EDUCACAO,20101.0,00394411000109,PRESIDENCIA DA REPUBLICA,4,FUNDACAO,E,F,True,True,2025-07-07T15:20:00
26309,CENTRO FEDERAL DE EDUCACAO TEC.DE B.GONCALVES,CEFET,94728821000192,26000.0,00394445000101,MINISTERIO DA EDUCACAO,20101.0,00394411000109,PRESIDENCIA DA REPUBLICA,3,AUTARQUIA,E,F,True,True,2025-07-07T15:25:00
96823,PREFEITURA DE TIRADENTES DO SUL - RS,PM TIRADENTES SUL,94726320000177,96320.0,87934675000196,ERS-ESTADO DO RIO GRANDE DO SUL,96000.0,0,REGIAO SUL,12,ADMINISTRACAO DIRETA MUNICIPAL,E,M,True,True,2024-01-14T13:57:00
96506,PREFEITURA MUNICIPAL DE BARRA DO GUARITA - RS,PM BARRA DO GUARITA,94726312000120,96320.0,87934675000196,ERS-ESTADO DO RIO GRANDE DO SUL,96000.0,0,REGIAO SUL,12,ADMINISTRACAO DIRETA MUNICIPAL,E,M,True,True,2024-01-13T13:57:00
96575,PREFEITURA MUNICIPAL DE CORONEL BARROS - RS,PM CORONEL BARROS,94721388000163,96320.0,87934675000196,ERS-ESTADO DO RIO GRANDE DO SUL,96000.0,0,REGIAO SUL,12,ADMINISTRACAO DIRETA MUNICIPAL,E,M,True,True,2024-01-14T13:57:00
96421,CAMARA MUNICIPAL DE NOVO HAMBURGO,CM DE NOVO HAMBURGO,94709284000133,96320.0,87934675000196,ERS-ESTADO DO RIO GRANDE DO SUL,96000.0,0,REGIAO SUL,12,ADMINISTRACAO DIRETA MUNICIPAL,E,M,True,True,2023-02-15T14:11:00
85134,INSTITUTO PRE ASSIS DOS SER MUN DE CAMPO BOM,IPASEM CB,94707817000148,96320.0,87934675000196,ERS-ESTADO DO RIO GRANDE DO SUL,96000.0,0,REGIAO SUL,14,ADMINISTRACAO INDIRETA MUNICIPAL,E,M,True,True,2024-04-04T09:40:00
96701,INSTITUTO DE PREV.E A.SERV.MUNIC.N.HAMBURGO X,INS.PREV N HAMBURGO,94707684000100,96697.0,88254875000160,PREFEITURA MUNICIPAL DE NOVO HAMBURGO - RS,96320.0,87934675000196,ERS-ESTADO DO RIO GRANDE DO SUL,3,AUTARQUIA,E,M,True,True,2024-02-16T16:25:00
96728,PREFEITURA MUNICIPAL DE PRESIDENTE LUCENA-RS,PM PRES. LUCENA-RS,94707494000192,96320.0,87934675000196,ERS-ESTADO DO RIO GRANDE DO SUL,96000.0,0,REGIAO SUL,12,ADMINISTRACAO DIRETA MUNICIPAL,E,M,True,True,2024-01-14T13:57:00
96664,PREFEITURA MUNICIPAL DE LINDOLFO COLLOR / RS,PM LINDOLFO COLLOR,94707486000146,96320.0,87934675000196,ERS-ESTADO DO RIO GRANDE DO SUL,96000.0,0,REGIAO SUL,12,ADMINISTRACAO DIRETA MUNICIPAL,E,M,True,True,2024-01-14T13:57:00
96552,PREFEITURA MUNICIPAL DE CAPITÃO - RS,PM DE CAPITÃO - RS,94706132000187,96320.0,87934675000196,ERS-ESTADO DO RIO GRANDE DO SUL,96000.0,0,REGIAO SUL,12,ADMINISTRACAO DIRETA MUNICIPAL,E,M,True,True,2024-01-13T13:57:00
96658,PREFEITURA MUNICIPAL LAGOA DE TRÊS CANTOS-RS,PM LAGO TRÊS CANTOS,94704277000149,96320.0,87934675000196,ERS-ESTADO DO RIO GRANDE DO SUL,96000.0,0,REGIAO SUL,12,ADMINISTRACAO DIRETA MUNICIPAL,E,M,True,True,2024-01-14T13:57:00
96599,PREFEITURA MUNICIPAL DE ENGENHO VELHO - RS,PM ENGENHO VELHO/RS,94704129000124,96320.0,87934675000196,ERS-ESTADO DO RIO GRANDE DO SUL,96000.0,0,REGIAO SUL,12,ADMINISTRACAO DIRETA MUNICIPAL,E,M,True,True,2024-01-14T13:57:00
96736,PREFEITURA MUNICIPAL DE RIO DOS INDIOS - RS,PM RIO DOS INDIOS,94704103000186,96320.0,87934675000196,ERS-ESTADO DO RIO GRANDE DO SUL,96000.0,0,REGIAO SUL,12,ADMINISTRACAO DIRETA MUNICIPAL,E,M,True,True,2024-01-14T13:57:00
96688,PREFEITURA MUNICIPAL DE NOVA BOA VISTA - RS,PM NOVA BOA VISTA,94704061000183,96320.0,87934675000196,ERS-ESTADO DO RIO GRANDE DO SUL,96000.0,0,REGIAO SUL,12,ADMINISTRACAO DIRETA MUNICIPAL,E,M,True,True,2024-01-14T13:57:00
96574,PREFEITURA MUNICIPAL DE COQUEIROS DO SUL - RS,PM COQUEIROS DO SUL,94703980000132,96320.0,87934675000196,ERS-ESTADO DO RIO GRANDE DO SUL,96000.0,0,REGIAO SUL,12,ADMINISTRACAO DIRETA MUNICIPAL,E,M,True,True,2024-01-14T13:57:00
96626,PREFEITURA MUNICIPAL GRAMADO DOS LOUREIROS-RS,PM GRAMADO LOUREIRO,94703964000140,96320.0,87934675000196,ERS-ESTADO DO RIO GRANDE DO SUL,96000.0,0,REGIAO SUL,12,ADMINISTRACAO DIRETA MUNICIPAL,E,M,True,True,2024-01-14T13:57:00
96673,PREFEITURA MUNICIPAL DE MATO LEITAO - RS,PM MATO LEITAO - RS,94577590000163,96320.0,87934675000196,ERS-ESTADO DO RIO GRANDE DO SUL,96000.0,0,REGIAO SUL,12,ADMINISTRACAO DIRETA MUNICIPAL,E,M,True,True,2024-01-14T13:57:00
96627,PREFEITURA MUNICIPAL DE GRAMADO XAVIER - RS,PM GRAMADO XAVIER,94577509000145,96320.0,87934675000196,ERS-ESTADO DO RIO GRANDE DO SUL,96000.0,0,REGIAO SUL,12,ADMINISTRACAO DIRETA MUNICIPAL,E,M,True,True,2024-01-14T13:57:00
96535,MRS-CAMARA MUNICIPAL DE SANTA CRUZ DO SUL,CM  S. CRUZ DO SUL,94576840000140,96320.0,87934675000196,ERS-ESTADO DO RIO GRANDE DO SUL,96000.0,0,REGIAO SUL,12,ADMINISTRACAO DIRETA MUNICIPAL,E,M,True,True,2025-02-28T09:55:00
26331,CENTRO FED.EDUCACAO TECNOLOGICA S.VICENTE SUL,CEFET/S.VICENTE SUL,94445673000107,26000.0,00394445000101,MINISTERIO DA EDUCACAO,20101.0,00394411000109,PRESIDENCIA DA REPUBLICA,3,AUTARQUIA,E,F,True,True,2025-07-07T15:29:00
96791,PREFEITURA MUNICIPAL SAO MARTINHO DA SERRA-RS,PM SÃO MART.SERRA,94444403000173,96320.0,87934675000196,ERS-ESTADO DO RIO GRANDE DO SUL,96000.0,0,REGIAO SUL,12,ADMINISTRACAO DIRETA MUNICIPAL,E,M,True,True,2024-01-14T13:57:00
96721,PREFEITURA MUNICIPAL DE PINHAL GRANDE - RS,PM DE PINHAL GRANDE,94444346000122,96320.0,87934675000196,ERS-ESTADO DO RIO GRANDE DO SUL,96000.0,0,REGIAO SUL,12,ADMINISTRACAO DIRETA MUNICIPAL,E,M,True,True,2024-01-14T13:57:00
96779,PREFEITURA MUNICIPAL SAO JOAO DO POLESINE-RS,PM S. JOAO POLESINE,94444247000140,96320.0,87934675000196,ERS-ESTADO DO RIO GRANDE DO SUL,96000.0,0,REGIAO SUL,12,ADMINISTRACAO DIRETA MUNICIPAL,E,M,True,True,2024-01-14T13:57:00
86363,PREFEITURA MUNICIPAL DE QUEVEDOS/RS,PM/QUEVEDOS/RS,94444122000110,96320.0,87934675000196,ERS-ESTADO DO RIO GRANDE DO SUL,96000.0,0,REGIAO SUL,12,ADMINISTRACAO DIRETA MUNICIPAL,E,M,True,True,2025-01-17T11:48:00
96586,PREFEITURA MUNICIPAL DE DERRUBADAS - RS,PM DERRUBADAS - RS,94442282000201,96320.0,87934675000196,ERS-ESTADO DO RIO GRANDE DO SUL,96000.0,0,REGIAO SUL,12,ADMINISTRACAO DIRETA MUNICIPAL,E,M,True,True,2024-01-14T13:57:00
96853,PREFEITURA MUNICIPAL DE XANGRI-LÁ  - RS,PM DE XANGRI-LÁ -RS,94436474000124,96320.0,87934675000196,ERS-ESTADO DO RIO GRANDE DO SUL,96000.0,0,REGIAO SUL,12,ADMINISTRACAO DIRETA MUNICIPAL,E,M,True,True,2024-01-14T13:57:00
86752,PREFEITURA MUNICIPAL DE MAQUINE/RS,PM/MAQUINE/RS,94436342000100,96320.0,87934675000196,ERS-ESTADO DO RIO GRANDE DO SUL,96000.0,0,REGIAO SUL,12,ADMINISTRACAO DIRETA MUNICIPAL,E,M,True,True,2025-05-08T09:20:00
96414,FUNDACAO GAUCHA DO TRABALHO E ACAO SOCIAL,FUNDMED - RS,94392164000155,96320.0,87934675000196,ERS-ESTADO DO RIO GRANDE DO SUL,96000.0,0,REGIAO SUL,4,FUNDACAO,E,E,True,True,2024-04-01T14:55:00
96415,FUNDAÇÃO HOSPITALAR DO RIO GRANDE DO SUL,FUNDA.HOSP. DO RS,94391901000103,96320.0,87934675000196,ERS-ESTADO DO RIO GRANDE DO SUL,96000.0,0,REGIAO SUL,4,FUNDACAO,E,E,True,True,2024-01-13T13:57:00
96690,COMPANHIA MUNICIPAL DE URBANISMO - N.HAMBRUGO,CIA MUN URBANISMO,94380763000159,96697.0,88254875000160,PREFEITURA MUNICIPAL DE NOVO HAMBURGO - RS,96320.0,87934675000196,ERS-ESTADO DO RIO GRANDE DO SUL,6,ECONOMIA MISTA,E,M,True,True,2024-04-05T17:00:00
96694,PREFEITURA MUNICIPAL DE NOVA SANTA RITA - RS,PM NOVA SANTA RITA,94309291000148,96320.0,87934675000196,ERS-ESTADO DO RIO GRANDE DO SUL,96000.0,0,REGIAO SUL,12,ADMINISTRACAO DIRETA MUNICIPAL,E,M,True,True,2024-01-14T13:57:00
96782,PREFEITURA MUNICIPAL SAO JOSÉ DO INHACORÃ-RS,PM S. JOSÉ INHACORÃ,94187358000119,96320.0,87934675000196,ERS-ESTADO DO RIO GRANDE DO SUL,96000.0,0,REGIAO SUL,12,ADMINISTRACAO DIRETA MUNICIPAL,E,M,True,True,2024-01-14T13:57:00
86743,PREFEITURA MUNICIPAL DE MARIANA PIMENTEL/RS,PMMP,94068418000184,96320.0,87934675000196,ERS-ESTADO DO RIO GRANDE DO SUL,96000.0,0,REGIAO SUL,12,ADMINISTRACAO DIRETA MUNICIPAL,E,M,True,True,2025-05-05T08:50:00
